{
  "contract_version": "0.1.0-frozen",
  "bundle_id": "EVIDENCE_DEMO_001",
  "request_id": "TOOL_REQ_DEMO_001",
  "research_job_id": "JOB_FIXTURE_001",
  "status": "COMPLETE",
  "coverage": "FULL",
  "evidence_type": "ASSOCIATIONAL",
  "engine_claim": "Fixture only: replace with the real MacroTrace engine synthesis.",
  "model_runs": [
    {
      "model_run_id": "RUN_FIXTURE_001",
      "model_recipe_id": "M.BRIDGE_OLS.V1",
      "status": "SUCCESS",
      "evidence_type": "ASSOCIATIONAL",
      "summary": "Fixture only; no empirical value is asserted.",
      "result_hash": "2222222222222222222222222222222222222222222222222222222222222222"
    }
  ],
  "diagnostics": [
    {
      "diagnostic_id": "DIAG_FIXTURE_001",
      "status": "PASS",
      "blocking": false,
      "interpretation": "Fixture only; replace with real diagnostic output."
    }
  ],
  "robustness": [],
  "evidence_items": [],
  "falsifiers": [],
  "limitations": [
    "This is a contract fixture and contains no real empirical conclusion.",
    "Associational evidence cannot support causal wording."
  ],
  "input_object_refs": [
    {
      "contract_version": "0.1.0-frozen",
      "object_id": "DATA_US_TREASURY_10Y",
      "version_id": "VER_DEMO_20260804",
      "object_type": "DATASET",
      "name": "10-year Treasury yield demo snapshot",
      "representation": "PARQUET",
      "schema_version": "1.0.0",
      "content_hash": "0000000000000000000000000000000000000000000000000000000000000000",
      "license_policy": "PUBLIC",
      "access_scope": "WORKSPACE:WS_DEMO",
      "content_uri": "objects/DATA_US_TREASURY_10Y/VER_DEMO_20260804/data.parquet",
      "as_of_date": "2026-08-04",
      "data_schema": {
        "time_key": "date",
        "entity_keys": [],
        "value_fields": [
          "ust10"
        ],
        "frequency": "D",
        "units": {
          "ust10": "percent"
        },
        "field_types": {
          "date": "date",
          "ust10": "float64"
        }
      },
      "lineage_refs": [
        "SRC_PUBLIC_DEMO"
      ],
      "metadata": {
        "fixture_only": true
      }
    }
  ],
  "registry_version": "macrotrace-fixture",
  "result_hash": "3333333333333333333333333333333333333333333333333333333333333333",
  "artifacts": [
    {
      "artifact_id": "GRAPH_FIXTURE_001",
      "artifact_type": "RESEARCH_GRAPH",
      "uri": "fixtures/demo/research_graph.json",
      "sha256": "4444444444444444444444444444444444444444444444444444444444444444"
    }
  ],
  "trace_ref": "TRACE_FIXTURE_001",
  "metadata": {
    "fixture_only": true
  }
}
